{
  "id": "w9/06-claude",
  "task": "w9",
  "iteration": 6,
  "tool": "claude",
  "generated_at": "2026-09-04T16:20:28Z",
  "prior_id": null,
  "scores": {
    "task_response": {
      "band": 6,
      "descriptor_evidence": "contexts/01-band-descriptors/task2-band-descriptors.md §Band 6 — \"some supporting arguments and evidence may be less relevant or inadequate\"",
      "justification": "Both sides appear and the position is maintained, but Body 2 supports the usefulness of AI rather than the exchange of personal data for software. The conclusion substitutes a different comparison."
    },
    "coherence": {
      "band": 6,
      "descriptor_evidence": "contexts/01-band-descriptors/task2-band-descriptors.md §Band 6 — \"reference and substitution may lack flexibility or clarity and result in some repetition\"",
      "justification": "Paragraphing is logical and connective range is broad. Repetition of personal information, modern technology and efficiently, together with the unclear reference in \"because they store numerous data\", prevents Band 7."
    },
    "lexical": {
      "band": 6,
      "descriptor_evidence": "contexts/01-band-descriptors/task2-band-descriptors.md §Band 6 — risk-taker clause; \"some errors in spelling and/or word formation\"",
      "justification": "Vocabulary range and risk-taking are evident, but six word-level failures, including a corrupted word in the thesis, exceed the Band 7 allowance. Collocation errors and repeated informal wording compound the problem."
    },
    "grammar": {
      "band": 6,
      "descriptor_evidence": "contexts/01-band-descriptors/task2-band-descriptors.md §Band 6 — complex forms \"not marked by the same level of accuracy\"",
      "justification": "The essay uses a wide range of complex structures, but only about three or four of thirteen sentences are fully error-free. Systematic determiner errors, gerund-subject agreement and faulty adjective-infinitive construction prevent Band 7."
    }
  },
  "overall": 6,
  "overall_rationale": "Four Band 6 scores total 24, giving 24 ÷ 4 = **6.0** (`contexts/01-band-descriptors/scoring-rules.md` §§1, 3). **Your route to 7.0 needs three criteria at 7: 7 + 7 + 7 + 6 = 27 ÷ 4 = 6.75, which rounds up to 7.0** (§3). TR 6→7 is rewrites #1, #2 and #5. CC 6→7 is rewrite #7 plus one visible noun for every pronoun — organisation is already at Band 7. LR 6→7 is the word pass plus rewrites #3, #6 and #9. Plan the route without GRA, your slowest-moving criterion across nine essays. Note that W5 and W6 both scored 6.5 on TR 7 / CC 7 — you have held both before, and both were lost in W7–W9 for reasons that live in one paragraph and one sentence each time.",
  "what_changed": "**Now agreed by both examiners:** all four scores; the top three priorities in this order — prompt-specific weighing, articles/countability, collocation; that the reference fault is Body 1's \"because **they** store numerous data\" (the main-clause subject is *a lot of hackers*), not the conclusion's \"they\", which points acceptably at *technology companies*; and that persistent collocation outranks intermittent spelling. **Corrected in this pass:** I withdrew my claim that connective diversity offsets linker density — the corpus audits them separately; I withdrew \"concession is new\" (W4, W6 and W7 all concede then rebut); I withdrew \"W8 was under-length\" (254 clears the floor — W4's 246 does not); and I removed every invented detail from the rewrites, which now use only your own material plus corpus collocations. **Newly added:** the sixth determiner error, \"gain the access to **individual's** data\", and the cliché-opener hit on \"Nowadays\". Nothing substantive remains contested.",
  "rewrites": [
    {
      "id": 1,
      "original": "Modern technology plays a vital role in people's every day life.",
      "improved": "**The principal advantage of this exchange is the access it buys.** Modern technology plays a vital role in **everyday life** because it enables people to work more efficiently.",
      "reason": "The TR-7 lever. Your topic sentence names the topic instead of claiming the advantage; one clause naming the *exchange* re-aims the paragraph. Recurring W1–W4, W6–W9.",
      "citations": [
        "contexts/05-band-6-to-7/task-response-upgrades.md",
        "contexts/05-band-6-to-7/paragraph-structure-band7.md"
      ],
      "category": "task_response"
    },
    {
      "id": 2,
      "original": "These days, people are ableto get health or legal advice from AI chatbot service, which would cost a lot of money if they reach to a doctor or a lawyer.",
      "improved": "These days, people **can obtain basic health or legal guidance from AI chatbot services that would cost a great deal if they consulted a doctor or a lawyer** — and **those services are cheap precisely because users pay for them with their data**.",
      "reason": "Completes the missing link: data → access → saving. Also repairs \"ableto\", the missing article, and *consult* for \"reach to\".",
      "citations": [
        "contexts/08-vocabulary-grammar/04-task-response-error-correction-bank.md",
        "contexts/10-task2-topic-banks/topic-03-technology.md"
      ],
      "category": "task_response"
    },
    {
      "id": 3,
      "original": "so that they can gain access and use a software",
      "improved": "\"so that they can **gain access to and use software**\"; \"gain access to **an individual's** data\"",
      "reason": "*Software* and *access* are uncountable — no *a*, no *the*. Six determiner errors here; \"a software\" is W1's \"a single hardware\" returning four months later. Covers both \"so that they can gain access and use a software\" and \"gain the access to individual's data\", including the missing determiner before \"individual's\".",
      "citations": [
        "contexts/08-vocabulary-grammar/01-grammar-error-correction-bank.md",
        "contexts/09-instructor-tips/10-common-korean-chinese-speaker-errors.md"
      ],
      "category": "grammar"
    },
    {
      "id": 4,
      "original": "the benefits outweigh the wbacks because using modern technologies allow people to live more efficiently",
      "improved": "the benefits **of this exchange** outweigh the **drawbacks**, because **using** modern technology **allows** people to live and work far more efficiently",
      "reason": "Your thesis carries a corrupted word and a gerund-subject error — the same fault as W6's \"provide them with a lot of money can be regarded\". A gerund subject is singular.",
      "citations": [
        "contexts/09-instructor-tips/10-common-korean-chinese-speaker-errors.md",
        "contexts/08-vocabulary-grammar/05-spelling-and-mechanics.md"
      ],
      "category": "grammar"
    },
    {
      "id": 5,
      "original": "I believe not utilizing modern technology is a more significant downside as they can provide us with cutting-edge software.",
      "improved": "**On balance, the convenience these services deliver outweighs a risk that individuals face in any case** — technology companies, in return, provide cutting-edge software.",
      "reason": "The conclusion answers a different question from the introduction, and the stray \"ortdra\" must go. An *outweigh* prompt needs the verdict on the prompt's own terms.",
      "citations": [
        "contexts/08-vocabulary-grammar/04-task-response-error-correction-bank.md"
      ],
      "category": "task_response"
    },
    {
      "id": 6,
      "original": "hackers who are trying to breach into a companies' database to steal the personal information",
      "improved": "hackers **who attempt to breach corporate databases** in order to steal **personal information**",
      "reason": "Three faults in one clause: *breach* is transitive; \"a companies'\" mixes a singular article with a plural possessive; generic \"the personal information\" needs no article.",
      "citations": [
        "contexts/10-task2-topic-banks/topic-03-technology.md",
        "contexts/08-vocabulary-grammar/01-grammar-error-correction-bank.md"
      ],
      "category": "lexical"
    },
    {
      "id": 7,
      "original": "because they store numerous data and are relatively easy to breach the security, compared to banks or other government services",
      "improved": "because **these firms hold vast amounts of data and their security is easier to breach** than that of banks or government agencies",
      "reason": "Anchors the pronoun (the main clause's subject is *hackers*); *data* is uncountable; and it unwinds the §F2 pattern where the adjective wrongly describes the company.",
      "citations": [
        "contexts/08-vocabulary-grammar/03-cohesion-error-correction-bank.md",
        "contexts/09-instructor-tips/10-common-korean-chinese-speaker-errors.md"
      ],
      "category": "coherence"
    },
    {
      "id": 8,
      "original": "there is always a risk to ge stolen even though individuals choose not to use the sevice, since every personal infmation is already stored",
      "improved": "there is always a **risk of data being stolen even if individuals decline these services, since most personal information** is already held in digital form",
      "reason": "Three corruptions, plus *risk of* + -ing and *every* with an uncountable noun — the same quantifier fault as W2's \"every research\" and W7's \"every children\".",
      "citations": [
        "contexts/08-vocabulary-grammar/02-vocabulary-error-correction-bank.md"
      ],
      "category": "lexical"
    },
    {
      "id": 9,
      "original": "Nowadays, a lot of people are willing…",
      "improved": "\"**In recent years, a growing number of** people…\"; \"**numerous** hackers…\"; \"would cost **a substantial sum**\"",